<?xml version="1.0" encoding="UTF-8"?>
<xs:schema xmlns:xs="http://www.w3.org/2001/XMLSchema" elementFormDefault="qualified">
  <xs:import namespace="http://www.w3.org/XML/1998/namespace" schemaLocation="xml.xsd"/>
  <xs:element name="quotes">
    <xs:complexType>
      <xs:sequence>
        <xs:element maxOccurs="unbounded" ref="quote"/>
      </xs:sequence>
    </xs:complexType>
  </xs:element>
  <xs:element name="quote">
    <xs:complexType>
      <xs:sequence>
        <xs:element maxOccurs="unbounded" ref="version"/>
        <xs:element ref="author" maxOccurs="5"/>
      </xs:sequence>
    </xs:complexType>
  </xs:element>
  <xs:element name="version">
    <xs:complexType>
      <xs:sequence>
        <xs:element ref="text"/>
        <xs:element ref="source"/>
      </xs:sequence>
      <xs:attribute name="status" use="required">
        <xs:simpleType>
          <xs:list>
            <xs:simpleType>
              <xs:restriction base="xs:string">
                <xs:enumeration value="original" />
                <xs:enumeration value="translation" />
                <xs:enumeration value="unpublished" />
              </xs:restriction>
            </xs:simpleType>
          </xs:list>
        </xs:simpleType>
      </xs:attribute>
      <xs:attribute ref="xml:lang" use="required"/>
    </xs:complexType>
  </xs:element>
  <xs:element name="text">
    <xs:complexType mixed="true">
      <xs:sequence>
        <xs:element name="em" minOccurs="0" maxOccurs="unbounded"/>
      </xs:sequence>
    </xs:complexType>
  </xs:element>
  <xs:element name="source">
    <xs:complexType>
      <xs:sequence>
        <xs:element ref="title"/>
        <xs:element ref="idref" minOccurs="0"/>
        <xs:element ref="page" minOccurs="0"/>
        <xs:element ref="translator" minOccurs="0" maxOccurs="unbounded"/>
      </xs:sequence>
    </xs:complexType>
  </xs:element>
  <xs:element name="idref" type="xs:integer"/>
  <xs:element name="page">
    <xs:simpleType>
      <xs:restriction base="xs:string">
        <xs:pattern value="([-0-9/]+)|(check)|([IVXLMC]+)"/>
      </xs:restriction>
    </xs:simpleType>
  </xs:element>
  <xs:element name="title" type="xs:string"/>
  <xs:element name="author" type="xs:string"/>
  <xs:element name="translator" type="xs:string"/>
</xs:schema>